infoflora:308100,Gefässpflanzen,Mittlerer Wegerich,Plantago media L.,www.infoflora.ch/flora/1034390,Basel,BS,"Magnolienpark/Gellertstrasse 21-23. Einzelbaeume, Alleen, Baumhaine. Hauptnutzung: Blockbebauungen, Reihenhaeuser.",267-269,"2612976","1266836","75",A,Bestandesklasse: mittel,,"2008","4","25",,Kanton Basel Stadt (Naturinventar),Frei Martin,"4158592",LC,K,L,,,,,,,LC,,,,,Plantaginaceae,,INN,,
infoflora:308100,Gefässpflanzen,Mittlerer Wegerich,Plantago media L.,www.infoflora.ch/flora/1034390,Basel,BS,,"277","2613198","1266843","5",A,,,"2018","4","4",,"Info Flora, Yvonne Reisner",Reisner Yvonne,"6537713",LC,K,L,,,,,,,LC,,,,,Plantaginaceae,,INN,,
infoflora:309200,Gefässpflanzen,Einjähriges Rispengras,Poa annua L.,www.infoflora.ch/flora/1034490,Basel,BS,,249-271,"2612025","1267118","100",A,,,"2021","7","22",,"Flora beider Basel, Jacques Burnand",Burnand Jacques,"10563462",LC,K,,,,,,,,LC,,,,,Poaceae,,INN,,
infoflora:309800,Gefässpflanzen,Platthalm-Rispengras,Poa compressa L.,www.infoflora.ch/flora/1034550,Basel,BS,Wieder in Steinritzen,249-250,"2611976","1267383","9",A,,,"2021","6","11",,"Flora beider Basel, Ursina Studer",Studer Ursina,"10354185",LC,K,L,,,,,,,LC,,,,,Poaceae,,INN,,
infoflora:309800,Gefässpflanzen,Platthalm-Rispengras,Poa compressa L.,www.infoflora.ch/flora/1034550,Basel,BS,,249-250,"2611801","1267463","4",A,,,"2022","5","11",,"Info Flora, Adrian Möhl","Möhl Adrian, Juillerat Philippe","11812978",LC,K,L,,,,,,,LC,,,,,Poaceae,,INN,,
infoflora:309800,Gefässpflanzen,Platthalm-Rispengras,Poa compressa L.,www.infoflora.ch/flora/1034550,Basel,BS,,249-250,"2611779","1267461","21",A,,,"2022","8","8",,"Flora beider Basel, Urs Käser",Käser Urs,"12502629",LC,K,L,,,,,,,LC,,,,,Poaceae,,INN,,
infoflora:310500,Gefässpflanzen,Hain-Rispengras,Poa nemoralis L.,www.infoflora.ch/flora/1034620,Basel,BS,"Kleinbasler Rheinufer unterhalb Schwarzwaldbrücke. Ruderalstandorte, Trittfluren, Pflaesterungen. Hauptnutzung: Fliessgewaesser.","250","2613037","1267548","100",A,Bestandesklasse: klein,,"2008","7","9",,Kanton Basel Stadt (Naturinventar),Lüthi Roland,"4146203",LC,K,,,,,,,,LC,,,,,Poaceae,,INN,,
infoflora:310500,Gefässpflanzen,Hain-Rispengras,Poa nemoralis L.,www.infoflora.ch/flora/1034620,Basel,BS,"Baumhain Mühleweg. Einzelbaeume, Alleen, Baumhaine. Hauptnutzung: oeffentliche Parks, Anlagen, Friedhoefe.",252-261,"2612090","1267148","56",A,Bestandesklasse: gross,,"2008","5","10",,Kanton Basel Stadt (Naturinventar),Frei Martin,"4150304",LC,K,,,,,,,,LC,,,,,Poaceae,,INN,,
infoflora:310500,Gefässpflanzen,Hain-Rispengras,Poa nemoralis L.,www.infoflora.ch/flora/1034620,Basel,BS,"Bauminsel St. Albananlage/Sevogelstr.. Einzelbaeume, Alleen, Baumhaine. Hauptnutzung: oeffentliche Parks, Anlagen, Friedhoefe.",268-269,"2612507","1266874","19",A,Bestandesklasse: mittel,,"2008","6","5",,Kanton Basel Stadt (Naturinventar),Frei Martin,"4150249",LC,K,,,,,,,,LC,,,,,Poaceae,,INN,,
infoflora:310500,Gefässpflanzen,Hain-Rispengras,Poa nemoralis L.,www.infoflora.ch/flora/1034620,Basel,BS,"Gellertpark, Gehölze. Einzelbaeume, Alleen, Baumhaine. Hauptnutzung: oeffentliche Parks, Anlagen, Friedhoefe.",259-269,"2613125","1266870","145",A,Bestandesklasse: mittel,,"2008","4","25",,Kanton Basel Stadt (Naturinventar),Frei Martin,"4149985",LC,K,,,,,,,,LC,,,,,Poaceae,,INN,,
infoflora:310500,Gefässpflanzen,Hain-Rispengras,Poa nemoralis L.,www.infoflora.ch/flora/1034620,Basel,BS,"Castellio-Weglein. Einzelbaeume, Alleen, Baumhaine. Hauptnutzung: oeffentliche Parks, Anlagen, Friedhoefe.",256-270,"2612160","1267093","61",A,Bestandesklasse: mittel,,"2008","5","10",,Kanton Basel Stadt (Naturinventar),Frei Martin,"4150286",LC,K,,,,,,,,LC,,,,,Poaceae,,INN,,
infoflora:310500,Gefässpflanzen,Hain-Rispengras,Poa nemoralis L.,www.infoflora.ch/flora/1034620,Basel,BS,"St. Alban-Teich Weidengasse-Zürcherstrasse. Mauern, Felsen. Hauptnutzung: Fliessgewaesser.",258-261,"2612670","1267015","153",A,Bestandesklasse: mittel,,"2008","8","28",,Kanton Basel Stadt (Naturinventar),Frei Martin,"4158933",LC,K,,,,,,,,LC,,,,,Poaceae,,INN,,
infoflora:310500,Gefässpflanzen,Hain-Rispengras,Poa nemoralis L.,www.infoflora.ch/flora/1034620,Basel,BS,"St. Alban-Teich beim St. Albantal. Mauern, Felsen. Hauptnutzung: Fliessgewaesser.",256-265,"2613001","1266834","342",A,Bestandesklasse: klein,,"2008","8","28",,Kanton Basel Stadt (Naturinventar),Frei Martin,"4158919",LC,K,,,,,,,,LC,,,,,Poaceae,,INN,,
infoflora:310500,Gefässpflanzen,Hain-Rispengras,Poa nemoralis L.,www.infoflora.ch/flora/1034620,Basel,BS,"Terrassenrand St. Alban - Teich. Waelder, Waldschlaege. Hauptnutzung: Laubwaelder.",258-260,"2612476","1267002","57",A,Bestandesklasse: klein,,"2009","5","12",,Kanton Basel Stadt (Naturinventar),Frei Martin,"4161119",LC,K,,,,,,,,LC,,,,,Poaceae,,INN,,
infoflora:313400,Gefässpflanzen,Vielblütiges Salomonssiegel,Polygonatum multiflorum (L.) All.,www.infoflora.ch/flora/1034920,Basel,BS,"Gellertpark, Gehölze. Einzelbaeume, Alleen, Baumhaine. Hauptnutzung: oeffentliche Parks, Anlagen, Friedhoefe.",259-269,"2613125","1266870","145",A,Bestandesklasse: gross,,"2008","4","25",,Kanton Basel Stadt (Naturinventar),Frei Martin,"4149949",LC,K,,,,,,,,LC,,,,,Asparagaceae,,INN,,
infoflora:313400,Gefässpflanzen,Vielblütiges Salomonssiegel,Polygonatum multiflorum (L.) All.,www.infoflora.ch/flora/1034920,Basel,BS,"Bauminsel St. Albananlage/Sevogelstr.. Einzelbaeume, Alleen, Baumhaine. Hauptnutzung: oeffentliche Parks, Anlagen, Friedhoefe.",268-269,"2612507","1266874","19",A,Bestandesklasse: klein,,"2008","6","5",,Kanton Basel Stadt (Naturinventar),Frei Martin,"4150247",LC,K,,,,,,,,LC,,,,,Asparagaceae,,INN,,
infoflora:313400,Gefässpflanzen,Vielblütiges Salomonssiegel,Polygonatum multiflorum (L.) All.,www.infoflora.ch/flora/1034920,Basel,BS,"Castellio-Weglein. Einzelbaeume, Alleen, Baumhaine. Hauptnutzung: oeffentliche Parks, Anlagen, Friedhoefe.",256-270,"2612160","1267093","61",A,Bestandesklasse: klein,,"2008","5","10",,Kanton Basel Stadt (Naturinventar),Frei Martin,"4150285",LC,K,,,,,,,,LC,,,,,Asparagaceae,,INN,,
infoflora:316500,Gefässpflanzen,Gelappter Schildfarn,Polystichum aculeatum (L.) Roth,www.infoflora.ch/flora/1035240,Basel,BS,"St. Alban-Teich beim St. Albantal. Mauern, Felsen. Hauptnutzung: Fliessgewaesser.",256-265,"2613001","1266834","342",A,Bestandesklasse: klein,,"2008","8","28",,Kanton Basel Stadt (Naturinventar),Frei Martin,"4158920",LC,K,,,,,,,,LC,,,,,Dryopteridaceae,,INN,,
infoflora:316500,Gefässpflanzen,Gelappter Schildfarn,Polystichum aculeatum (L.) Roth,www.infoflora.ch/flora/1035240,Basel,BS,"Gellertpark, Gehölze. Einzelbaeume, Alleen, Baumhaine. Hauptnutzung: oeffentliche Parks, Anlagen, Friedhoefe.",259-269,"2613125","1266870","145",A,Bestandesklasse: klein,,"2008","4","25",,Kanton Basel Stadt (Naturinventar),Frei Martin,"4149993",LC,K,,,,,,,,LC,,,,,Dryopteridaceae,,INN,,
infoflora:317500,Gefässpflanzen,Zitter-Pappel,Populus tremula L.,www.infoflora.ch/flora/1035360,Basel,BS,"Mühlegraben bei St. Alban-Tal. Wiesen, Weiden, Scherrasen. Hauptnutzung: Hist. Altstadt / Dorfkern / City / Mischnutzungen.",251-258,"2612463","1267085","82",A,Bestandesklasse: klein,,"2008","6","13",,Kanton Basel Stadt (Naturinventar),Lüthi Roland,"4151573",LC,K,,,,,,,,LC,,,,,Salicaceae,,INN,,
infoflora:317500,Gefässpflanzen,Zitter-Pappel,Populus tremula L.,www.infoflora.ch/flora/1035360,Basel,BS,"Rheinberme zw. Rheinbad Breite und Bollwerk St. Alban. Ruderalstandorte, Trittfluren, Pflaesterungen. Hauptnutzung: Fliessgewaesser.",250-251,"2612703","1267237","251",A,Bestandesklasse: klein,,"2008","7","8",,Kanton Basel Stadt (Naturinventar),Lüthi Roland,"4151910",LC,K,,,,,,,,LC,,,,,Salicaceae,,INN,,
infoflora:317650,Gefässpflanzen,Gemüse-Portulak,Portulaca oleracea L.,www.infoflora.ch/flora/1035410,Basel,BS,,247-278,"2611866","1267366","999",A,,,"2011","10","1",,"Info Flora, Andre Hospers",Hospers Andre,"4885005",LC,K,,,,,,,,LC,,,,,Portulacaceae,,INN,,
infoflora:317650,Gefässpflanzen,Gemüse-Portulak,Portulaca oleracea L.,www.infoflora.ch/flora/1035410,Basel,BS,"Schaffhauser Rheinweg, Treppe an Rhein","255","2612324","1267367","5",A,,,"2015","7","25",,"Info Flora, Lucas Förderer",Förderer Lucas,"5213027",LC,K,,,,,,,,LC,"TypoCH 9 : Bauten, Anlagen",,,,Portulacaceae,,INN,,
infoflora:318500,Gefässpflanzen,Krauses Laichkraut,Potamogeton crispus L.,www.infoflora.ch/flora/1035490,Basel,BS,"Bei Solitude im Rhein; Rhein nahe Ufer",250-255,"2613077","1267554","5",A,,,"2018","6","23",,"Info Flora, Lucas Förderer",Förderer Lucas,"6818732",LC,K,,,,,,,,LC,TypoCH 1 : Gewässer,,,,Potamogetonaceae,,INN,,
infoflora:318500,Gefässpflanzen,Krauses Laichkraut,Potamogeton crispus L.,www.infoflora.ch/flora/1035490,Basel,BS,"Bei Schwarzwaldbrücke im Rhein; Im Rhein",255-260,"2613009","1267516","5",A,,,"2019","8","16",,"Info Flora, Lucas Förderer",Förderer Lucas,"8290747",LC,K,,,,,,,,LC,TypoCH 1 : Gewässer,,,,Potamogetonaceae,,INN,,
infoflora:318500,Gefässpflanzen,Krauses Laichkraut,Potamogeton crispus L.,www.infoflora.ch/flora/1035490,Basel,BS,"Im Rhein bei Solitude; Im Rhein",250-255,"2612957","1267503","5",A,,,"2020","6","24",,"Info Flora, Lucas Förderer",Förderer Lucas,"9245659",LC,K,,,,,,,,LC,TypoCH 1 : Gewässer,,,,Potamogetonaceae,,INN,,
infoflora:318500,Gefässpflanzen,Krauses Laichkraut,Potamogeton crispus L.,www.infoflora.ch/flora/1035490,Basel,BS,,"250","2612343","1267357","3",A,,,"2022","6","23",,"Flora beider Basel, Dóra Steták",Steták Dóra,"12275115",LC,K,,,,,,,,LC,,,,,Potamogetonaceae,,INN,,
infoflora:318500,Gefässpflanzen,Krauses Laichkraut,Potamogeton crispus L.,www.infoflora.ch/flora/1035490,Basel,BS,,250-250,"2612945","1267516","12",A,,,"2022","6","2",,"Flora beider Basel, Dóra Steták",Steták Dóra,"12147744",LC,K,,,,,,,,LC,,,,,Potamogetonaceae,,INN,,
infoflora:319700,Gefässpflanzen,Kammförmiges Laichkraut,Potamogeton pectinatus L.,www.infoflora.ch/flora/1035580,Basel,BS,,"250","2612343","1267357","3",A,,,"2022","6","23",,"Flora beider Basel, Dóra Steták",Steták Dóra,"12275114",LC,K,,,,,,,,LC,,,,,Potamogetonaceae,,INN,,
infoflora:319700,Gefässpflanzen,Kammförmiges Laichkraut,Potamogeton pectinatus L.,www.infoflora.ch/flora/1035580,Basel,BS,,250-250,"2612945","1267516","12",A,,,"2022","6","2",,"Flora beider Basel, Dóra Steták",Steták Dóra,"12147743",LC,K,,,,,,,,LC,,,,,Potamogetonaceae,,INN,,
infoflora:319800,Gefässpflanzen,Durchwachsenes Laichkraut,Potamogeton perfoliatus L.,www.infoflora.ch/flora/1035590,Basel,BS,"Bei Schwarzwaldbrücke im Rhein; Im Rhein",255-260,"2613009","1267516","5",A,,,"2019","8","16",,"Info Flora, Lucas Förderer",Förderer Lucas,"8290748",LC,K,,,,,,,,LC,TypoCH 1 : Gewässer,,,,Potamogetonaceae,,INN,,
infoflora:319800,Gefässpflanzen,Durchwachsenes Laichkraut,Potamogeton perfoliatus L.,www.infoflora.ch/flora/1035590,Basel,BS,"Im Rhein bei Solitude; Im Rhein",250-255,"2612957","1267503","5",A,,,"2020","7","5",,"Info Flora, Lucas Förderer",Förderer Lucas,"9246366",LC,K,,,,,,,,LC,TypoCH 1 : Gewässer,,,,Potamogetonaceae,,INN,,
infoflora:319800,Gefässpflanzen,Durchwachsenes Laichkraut,Potamogeton perfoliatus L.,www.infoflora.ch/flora/1035590,Basel,BS,,250-250,"2613100","1267361","4",A,,,"2022","6","23",,"Flora beider Basel, Dóra Steták",Steták Dóra,"12275116",LC,K,,,,,,,,LC,,,,,Potamogetonaceae,,INN,,
infoflora:320900,Gefässpflanzen,Gänse-Fingerkraut,Potentilla anserina L.,www.infoflora.ch/flora/1035700,Basel,BS,"Mühlegraben bei St. Alban-Tal. Wiesen, Weiden, Scherrasen. Hauptnutzung: Hist. Altstadt / Dorfkern / City / Mischnutzungen.",251-258,"2612463","1267085","82",A,Bestandesklasse: mittel,,"2008","6","13",,Kanton Basel Stadt (Naturinventar),Lüthi Roland,"4151561",LC,K,,,,,,,,LC,,,,,Rosaceae,,INN,,
infoflora:324700,Gefässpflanzen,Erdbeer-Fingerkraut,Potentilla sterilis (L.) Garcke,www.infoflora.ch/flora/1036060,Basel,BS,"Gellertpark, Gehölze. Einzelbaeume, Alleen, Baumhaine. Hauptnutzung: oeffentliche Parks, Anlagen, Friedhoefe.",259-269,"2613125","1266870","145",A,Bestandesklasse: mittel,,"2008","4","25",,Kanton Basel Stadt (Naturinventar),Frei Martin,"4149965",LC,K,,,,,,,,LC,,,,,Rosaceae,,INN,,
infoflora:324700,Gefässpflanzen,Erdbeer-Fingerkraut,Potentilla sterilis (L.) Garcke,www.infoflora.ch/flora/1036060,Basel,BS,"Gellertpark, Wiese. Wiesen, Weiden, Scherrasen. Hauptnutzung: oeffentliche Parks, Anlagen, Friedhoefe.",262-267,"2613158","1266888","76",A,Bestandesklasse: mittel,,"2008","6","13",,Kanton Basel Stadt (Naturinventar),Frei Martin,"4150141",LC,K,,,,,,,,LC,,,,,Rosaceae,,INN,,
infoflora:324700,Gefässpflanzen,Erdbeer-Fingerkraut,Potentilla sterilis (L.) Garcke,www.infoflora.ch/flora/1036060,Basel,BS,,"268","2613069","1266768","10",A,,,"2018","4","4",,"Info Flora, Yvonne Reisner",Reisner Yvonne,"6537661",LC,K,,,,,,,,LC,,,,,Rosaceae,,INN,,
infoflora:325100,Gefässpflanzen,Frühlings-Fingerkraut,Potentilla verna L.,www.infoflora.ch/flora/1036090,Basel,BS,"Gellertpark, Wiese. Wiesen, Weiden, Scherrasen. Hauptnutzung: oeffentliche Parks, Anlagen, Friedhoefe.",262-267,"2613158","1266888","76",A,Bestandesklasse: klein,,"2008","6","13",,Kanton Basel Stadt (Naturinventar),Frei Martin,"4150148",LC,K,L,,,,,,,LC,,,,,Rosaceae,,INN,,
infoflora:325100,Gefässpflanzen,Frühlings-Fingerkraut,Potentilla verna L.,www.infoflora.ch/flora/1036090,Basel,BS,"Bauminsel St. Albananlage/Sevogelstr.. Einzelbaeume, Alleen, Baumhaine. Hauptnutzung: oeffentliche Parks, Anlagen, Friedhoefe.",268-269,"2612507","1266874","19",A,Bestandesklasse: mittel,,"2008","6","5",,Kanton Basel Stadt (Naturinventar),Frei Martin,"4150239",LC,K,L,,,,,,,LC,,,,,Rosaceae,,INN,,
infoflora:325950,Gefässpflanzen,Wald-Schlüsselblume,Primula elatior (L.) L.,www.infoflora.ch/flora/1036200,Basel,BS,"Gellertpark, Gehölze. Einzelbaeume, Alleen, Baumhaine. Hauptnutzung: oeffentliche Parks, Anlagen, Friedhoefe.",259-269,"2613125","1266870","145",A,Bestandesklasse: mittel,,"2008","4","25",,Kanton Basel Stadt (Naturinventar),Frei Martin,"4149977",LC,K,,,,,,,,LC,,,,,Primulaceae,,INN,,
infoflora:328400,Gefässpflanzen,Süsskirsche,Prunus avium L.,www.infoflora.ch/flora/1036500,Basel,BS,"Gellertpark, Gehölze. Einzelbaeume, Alleen, Baumhaine. Hauptnutzung: oeffentliche Parks, Anlagen, Friedhoefe.",259-269,"2613125","1266870","145",A,Bestandesklasse: klein,,"2008","4","25",,Kanton Basel Stadt (Naturinventar),Frei Martin,"4149989",LC,K,,,,,,,,LC,,,,,Rosaceae,,INN,,
infoflora:328400,Gefässpflanzen,Süsskirsche,Prunus avium L.,www.infoflora.ch/flora/1036500,Basel,BS,"Terrassenrand St. Alban - Teich. Waelder, Waldschlaege. Hauptnutzung: Laubwaelder.",258-260,"2612476","1267002","57",A,Bestandesklasse: klein,,"2009","5","12",,Kanton Basel Stadt (Naturinventar),Frei Martin,"4161109",LC,K,,,,,,,,LC,,,,,Rosaceae,,INN,,
infoflora:328400,Gefässpflanzen,Süsskirsche,Prunus avium L.,www.infoflora.ch/flora/1036500,Basel,BS,"Cécile-Ines-Loos-Anlage, Gebüschbereiche. Hecken, Gebuesche, Feldgehoelze. Hauptnutzung: oeffentliche Parks, Anlagen, Friedhoefe.",251-255,"2613156","1267310","45",A,Bestandesklasse: klein,,"2009",,,,Kanton Basel Stadt (Naturinventar),?,"4150157",LC,K,,,,,,,,LC,,,,,Rosaceae,,INN,,
infoflora:329040,Gefässpflanzen,Zwetschgenbaum,Prunus domestica L.,www.infoflora.ch/flora/1036550,Basel,BS,,249-250,"2612005","1267375","6",A,,,"2022","5","15",,"Flora beider Basel, Lucienne de Witte",de Witte Lucienne,"11831668",,,,,,,,,,,,,,,Rosaceae,,NEO,"1",S
infoflora:329600,Gefässpflanzen,Traubenkirsche,Prunus padus L.,www.infoflora.ch/flora/1036620,Basel,BS,"Gellertpark, Gehölze. Einzelbaeume, Alleen, Baumhaine. Hauptnutzung: oeffentliche Parks, Anlagen, Friedhoefe.",259-269,"2613125","1266870","145",A,Bestandesklasse: klein,,"2008","4","25",,Kanton Basel Stadt (Naturinventar),Frei Martin,"4149980",LC,K,,,,,,,,LC,,,,,Rosaceae,,INN,,
infoflora:329600,Gefässpflanzen,Traubenkirsche,Prunus padus L.,www.infoflora.ch/flora/1036620,Basel,BS,"Rheinberme zw. Rheinbad Breite und Bollwerk St. Alban. Ruderalstandorte, Trittfluren, Pflaesterungen. Hauptnutzung: Fliessgewaesser.",250-251,"2612703","1267237","251",A,Bestandesklasse: klein,,"2008","7","8",,Kanton Basel Stadt (Naturinventar),Lüthi Roland,"4151927",LC,K,,,,,,,,LC,,,,,Rosaceae,,INN,,
infoflora:329600,Gefässpflanzen,Traubenkirsche,Prunus padus L.,www.infoflora.ch/flora/1036620,Basel,BS,"Letziplatz im St. Alban-Tal. Ruderalstandorte, Trittfluren, Pflaesterungen. Hauptnutzung: Hist. Altstadt / Dorfkern / City / Mischnutzungen.",251-258,"2612441","1267087","85",A,Bestandesklasse: klein,,"2008","6","13",,Kanton Basel Stadt (Naturinventar),Lüthi Roland,"4152230",LC,K,,,,,,,,LC,,,,,Rosaceae,,INN,,
infoflora:329600,Gefässpflanzen,Traubenkirsche,Prunus padus L.,www.infoflora.ch/flora/1036620,Basel,BS,"Kleinbasler Rheinufer unterhalb Schwarzwaldbrücke. Ruderalstandorte, Trittfluren, Pflaesterungen. Hauptnutzung: Fliessgewaesser.","250","2613037","1267548","100",A,Bestandesklasse: klein,,"2008","7","9",,Kanton Basel Stadt (Naturinventar),Lüthi Roland,"4146174",LC,K,,,,,,,,LC,,,,,Rosaceae,,INN,,
infoflora:330300,Gefässpflanzen,Schwarzdorn,Prunus spinosa L.,www.infoflora.ch/flora/1036670,Basel,BS,"Rheinböschung zw. Schwarzwaldbrücke und Rheinbord Breite. Ruderalstandorte, Trittfluren, Pflaesterungen. Hauptnutzung: Fliessgewaesser.",250-251,"2613078","1267334","151",A,Bestandesklasse: klein,,"2008","7","8",,Kanton Basel Stadt (Naturinventar),Lüthi Roland,"4151881",LC,K,L,,,,,,,LC,,,,,Rosaceae,,INN,,
infoflora:330300,Gefässpflanzen,Schwarzdorn,Prunus spinosa L.,www.infoflora.ch/flora/1036670,Basel,BS,"Kleinbasler Rheinufer, grasiger Oberstreifen mit Bäumen, zw. St. Alban-Fähre u.. Wiesen, Weiden, Scherrasen. Hauptnutzung: Fliessgewaesser.","250","2612431","1267384","117",A,Bestandesklasse: klein,,"2008","7","23",,Kanton Basel Stadt (Naturinventar),Lüthi Roland,"4146435",LC,K,L,,,,,,,LC,,,,,Rosaceae,,INN,,
infoflora:330300,Gefässpflanzen,Schwarzdorn,Prunus spinosa L.,www.infoflora.ch/flora/1036670,Basel,BS,"Magnolienpark/Gellertstrasse 21-23. Einzelbaeume, Alleen, Baumhaine. Hauptnutzung: Blockbebauungen, Reihenhaeuser.",267-269,"2612976","1266836","75",A,Bestandesklasse: klein,,"2008","4","25",,Kanton Basel Stadt (Naturinventar),Frei Martin,"4158594",LC,K,L,,,,,,,LC,,,,,Rosaceae,,INN,,
infoflora:330300,Gefässpflanzen,Schwarzdorn,Prunus spinosa L.,www.infoflora.ch/flora/1036670,Basel,BS,"Cécile-Ines-Loos-Anlage, Gebüschbereiche. Hecken, Gebuesche, Feldgehoelze. Hauptnutzung: oeffentliche Parks, Anlagen, Friedhoefe.",251-255,"2613156","1267310","45",A,Bestandesklasse: mittel,,"2009",,,,Kanton Basel Stadt (Naturinventar),?,"4150163",LC,K,L,,,,,,,LC,,,,,Rosaceae,,INN,,
infoflora:332800,Gefässpflanzen,Dunkelgrünes Lungenkraut,Pulmonaria obscura Dumort.,www.infoflora.ch/flora/1036950,Basel,BS,"Gellertpark, Gehölze. Einzelbaeume, Alleen, Baumhaine. Hauptnutzung: oeffentliche Parks, Anlagen, Friedhoefe.",259-269,"2613125","1266870","145",A,Bestandesklasse: klein,,"2008","4","25",,Kanton Basel Stadt (Naturinventar),Frei Martin,"4149974",LC,K,,,,,,,,LC,,,,,Boraginaceae,,INN,,
infoflora:334350,Gefässpflanzen,Feuerdorn,Pyracantha coccinea M. Roem.,www.infoflora.ch/flora/1037140,Basel,BS,Solitude. Uferböschung am Rhein.,"255","2612980","1267532","7",A,,,"2011","10","2",,"Info Flora, Lucas Förderer",Förderer Lucas,"3192841",,,,,,,,,,,"TypoCH 5 : Krautsäume, Hochstaudenfluren und Gebüsche",,,,Rosaceae,,NEO,"1",Ix
infoflora:336100,Gefässpflanzen,Stiel-Eiche,Quercus robur L.,www.infoflora.ch/flora/1037330,Basel,BS,"Baumhain Mühleweg. Einzelbaeume, Alleen, Baumhaine. Hauptnutzung: oeffentliche Parks, Anlagen, Friedhoefe.",252-261,"2612090","1267148","56",A,Bestandesklasse: klein,,"2008","5","10",,Kanton Basel Stadt (Naturinventar),Frei Martin,"4150302",LC,K,,,,,,,,LC,,,,,Fagaceae,,INN,,
infoflora:336100,Gefässpflanzen,Stiel-Eiche,Quercus robur L.,www.infoflora.ch/flora/1037330,Basel,BS,"Cécile-Ines-Loos-Anlage, Gebüschbereiche. Hecken, Gebuesche, Feldgehoelze. Hauptnutzung: oeffentliche Parks, Anlagen, Friedhoefe.",251-255,"2613156","1267310","45",A,Bestandesklasse: klein,,"2009",,,,Kanton Basel Stadt (Naturinventar),?,"4150191",LC,K,,,,,,,,LC,,,,,Fagaceae,,INN,,
infoflora:336600,Gefässpflanzen,Gewöhnlicher Scharfer Hahnenfuss,Ranunculus acris L. subsp. acris,www.infoflora.ch/flora/1037380,Basel,BS,,"263","2613099","1266723","65",A,,,"2018","4","4",,"Info Flora, Yvonne Reisner",Reisner Yvonne,"6537718",LC,K,,,,,,,,DD,,,,,Ranunculaceae,,INN,,
infoflora:336700,Gefässpflanzen,Fries' Scharfer Hahnenfuss,Ranunculus acris subsp. friesianus (Jord.) Syme,www.infoflora.ch/flora/1037390,Basel,BS,,"270","2612150","1266850","25",A,,,"2014","4","23",,"Info Flora, Jürg Röthlisberger",Röthlisberger Jürg,"4896300",LC,K,,,,,,,,LC,,,,,Ranunculaceae,,INN,,
infoflora:337300,Gefässpflanzen,Gold-Hahnenfuss,Ranunculus auricomus aggr.,www.infoflora.ch/flora/1037460,Basel,BS,"Gellertpark, Gehölze. Einzelbaeume, Alleen, Baumhaine. Hauptnutzung: oeffentliche Parks, Anlagen, Friedhoefe.",259-269,"2613125","1266870","145",A,Bestandesklasse: gross,,"2008","4","25",,Kanton Basel Stadt (Naturinventar),Frei Martin,"4149951",LC,K,,,,,,,,LC,,,,,Ranunculaceae,,INN,,
infoflora:337300,Gefässpflanzen,Gold-Hahnenfuss,Ranunculus auricomus aggr.,www.infoflora.ch/flora/1037460,Basel,BS,"Baumhain Mühleweg. Einzelbaeume, Alleen, Baumhaine. Hauptnutzung: oeffentliche Parks, Anlagen, Friedhoefe.",252-261,"2612090","1267148","56",A,Bestandesklasse: klein,,"2008","5","10",,Kanton Basel Stadt (Naturinventar),Frei Martin,"4150301",LC,K,,,,,,,,LC,,,,,Ranunculaceae,,INN,,
infoflora:337300,Gefässpflanzen,Gold-Hahnenfuss,Ranunculus auricomus aggr.,www.infoflora.ch/flora/1037460,Basel,BS,"Magnolienpark/Gellertstrasse 21-23. Einzelbaeume, Alleen, Baumhaine. Hauptnutzung: Blockbebauungen, Reihenhaeuser.",267-269,"2612976","1266836","75",A,Bestandesklasse: mittel,,"2008","4","25",,Kanton Basel Stadt (Naturinventar),Frei Martin,"4158596",LC,K,,,,,,,,LC,,,,,Ranunculaceae,,INN,,
infoflora:337300,Gefässpflanzen,Gold-Hahnenfuss,Ranunculus auricomus aggr.,www.infoflora.ch/flora/1037460,Basel,BS,"Terrassenrand St. Alban - Teich. Waelder, Waldschlaege. Hauptnutzung: Laubwaelder.",258-260,"2612476","1267002","57",A,Bestandesklasse: mittel,,"2009","5","12",,Kanton Basel Stadt (Naturinventar),Frei Martin,"4161097",LC,K,,,,,,,,LC,,,,,Ranunculaceae,,INN,,
infoflora:337300,Gefässpflanzen,Gold-Hahnenfuss,Ranunculus auricomus aggr.,www.infoflora.ch/flora/1037460,Basel,BS,,"265","2613166","1266863","65",A,,,"2018","4","4",,"Info Flora, Yvonne Reisner",Reisner Yvonne,"6537572",LC,K,,,,,,,,LC,,,,,Ranunculaceae,,INN,,
infoflora:337700,Gefässpflanzen,Knolliger Hahnenfuss,Ranunculus bulbosus L.,www.infoflora.ch/flora/1037510,Basel,BS,"St. Alban-Tor. Einzelbaeume, Alleen, Baumhaine. Hauptnutzung: oeffentliche Parks, Anlagen, Friedhoefe.",265-268,"2612485","1266930","53",A,Bestandesklasse: mittel,,"2008","6","5",,Kanton Basel Stadt (Naturinventar),Frei Martin,"4157654",LC,K,L,,,,,,,LC,,,,,Ranunculaceae,,INN,,
infoflora:337700,Gefässpflanzen,Knolliger Hahnenfuss,Ranunculus bulbosus L.,www.infoflora.ch/flora/1037510,Basel,BS,"Gellertpark, Gehölze. Einzelbaeume, Alleen, Baumhaine. Hauptnutzung: oeffentliche Parks, Anlagen, Friedhoefe.",259-269,"2613125","1266870","145",A,Bestandesklasse: mittel,,"2008","4","25",,Kanton Basel Stadt (Naturinventar),Frei Martin,"4149950",LC,K,L,,,,,,,LC,,,,,Ranunculaceae,,INN,,
infoflora:337700,Gefässpflanzen,Knolliger Hahnenfuss,Ranunculus bulbosus L.,www.infoflora.ch/flora/1037510,Basel,BS,"Gellertpark, Wiese. Wiesen, Weiden, Scherrasen. Hauptnutzung: oeffentliche Parks, Anlagen, Friedhoefe.",262-267,"2613158","1266888","76",A,Bestandesklasse: gross,,"2008","6","13",,Kanton Basel Stadt (Naturinventar),Frei Martin,"4150137",LC,K,L,,,,,,,LC,,,,,Ranunculaceae,,INN,,
infoflora:337700,Gefässpflanzen,Knolliger Hahnenfuss,Ranunculus bulbosus L.,www.infoflora.ch/flora/1037510,Basel,BS,,"253","2613227","1266935","65",A,,,"2018","4","4",,"Info Flora, Yvonne Reisner",Reisner Yvonne,"6537736",LC,K,L,,,,,,,LC,,,,,Ranunculaceae,,INN,,
infoflora:337700,Gefässpflanzen,Knolliger Hahnenfuss,Ranunculus bulbosus L.,www.infoflora.ch/flora/1037510,Basel,BS,,250-250,"2613042","1267324","6",A,,,"2021","4","5",,"Info Flora, Dominik Keller",Keller Dominik,"10144480",LC,K,L,,,,,,,LC,,,,,Ranunculaceae,,INN,,
infoflora:338200,Gefässpflanzen,Scharbockskraut,Ranunculus ficaria L.,www.infoflora.ch/flora/1037550,Basel,BS,,"270","2612500","1266930","25",A,,,"2014","4","6",,"Info Flora, Jürg Röthlisberger",Röthlisberger Jürg,"4896187",LC,K,,,,,,,,LC,,,,,Ranunculaceae,,INN,,
infoflora:338200,Gefässpflanzen,Scharbockskraut,Ranunculus ficaria L.,www.infoflora.ch/flora/1037550,Basel,BS,,"267","2613098","1266864","5",A,,,"2018","4","4",,"Info Flora, Yvonne Reisner",Reisner Yvonne,"6537733",LC,K,,,,,,,,LC,,,,,Ranunculaceae,,INN,,
infoflora:340900,Gefässpflanzen,Kriechender Hahnenfuss,Ranunculus repens L.,www.infoflora.ch/flora/1037840,Basel,BS,,"265","2611920","1266790","25",A,,,"2014","4","23",,"Info Flora, Jürg Röthlisberger",Röthlisberger Jürg,"4896414",LC,K,,,,,,,,LC,,,,,Ranunculaceae,,INN,,
infoflora:342900,Gefässpflanzen,Gelbe Reseda,Reseda lutea L.,www.infoflora.ch/flora/1038110,Basel,BS,"Verkehrsgrün Zürcherstrasse/Breite. Wiesen, Weiden, Scherrasen. Hauptnutzung: Strassenraum.",253-256,"2613209","1267226","61",A,Bestandesklasse: klein,,"2008","5","6",,Kanton Basel Stadt (Naturinventar),Frei Martin,"4158754",LC,K,L,,,,,,,LC,,,,,Resedaceae,,INN,,
infoflora:342900,Gefässpflanzen,Gelbe Reseda,Reseda lutea L.,www.infoflora.ch/flora/1038110,Basel,BS,"Cécile-Ines-Loos-Anlage, Wiesenberieche. Wiesen, Weiden, Scherrasen. Hauptnutzung: oeffentliche Parks, Anlagen, Friedhoefe.",250-254,"2613172","1267318","48",A,Bestandesklasse: klein,,"2008","6","5",,Kanton Basel Stadt (Naturinventar),Frei Martin,"4150235",LC,K,L,,,,,,,LC,,,,,Resedaceae,,INN,,
