infoflora:35900,Gefässpflanzen,Wiesen-Kerbel,Anthriscus sylvestris (L.) Hoffm.,www.infoflora.ch/flora/1004010,Basel,BS,,"260","2613155","1266858","65",A,,,"2018","4","4",,"Info Flora, Yvonne Reisner",Reisner Yvonne,"6537670",LC,K,,,,,,,,LC,,,,,Apiaceae,,INN,,
infoflora:37000,Gefässpflanzen,Karpaten-Wundklee,Anthyllis vulneraria subsp. carpatica (Pant.) Nyman,www.infoflora.ch/flora/1004100,Basel,BS,"Cécile-Ines-Loos-Anlage, Wiesenberieche. Wiesen, Weiden, Scherrasen. Hauptnutzung: oeffentliche Parks, Anlagen, Friedhoefe.",250-254,"2613172","1267318","48",A,Bestandesklasse: mittel,,"2008","6","5",,Kanton Basel Stadt (Naturinventar),Frei Martin,"4150226",LC,K,,,,,,,,LC,,,,,Fabaceae,,INN,,
infoflora:37000,Gefässpflanzen,Karpaten-Wundklee,Anthyllis vulneraria subsp. carpatica (Pant.) Nyman,www.infoflora.ch/flora/1004100,Basel,BS,"Verkehrsgrün Zürcherstrasse/Breite. Wiesen, Weiden, Scherrasen. Hauptnutzung: Strassenraum.",253-256,"2613209","1267226","61",A,Bestandesklasse: mittel,,"2008","5","6",,Kanton Basel Stadt (Naturinventar),Frei Martin,"4158749",LC,K,,,,,,,,LC,,,,,Fabaceae,,INN,,
infoflora:39200,Gefässpflanzen,Schotenkresse,Arabidopsis thaliana (L.) Heynh.,www.infoflora.ch/flora/1004340,Basel,BS,,269-270,"2611901","1266931","11",A,,,"2022","5","11",,"Info Flora, Adrian Möhl","Möhl Adrian, Juillerat Philippe","11812992",LC,K,,,,,,,,LC,,,,,Brassicaceae,,INN,,
infoflora:42200,Gefässpflanzen,Grosse Klette,Arctium lappa L.,www.infoflora.ch/flora/1004610,Basel,BS,"Baumhain Mühleweg. Einzelbaeume, Alleen, Baumhaine. Hauptnutzung: oeffentliche Parks, Anlagen, Friedhoefe.",252-261,"2612090","1267148","56",A,Bestandesklasse: klein,,"2008","5","10",,Kanton Basel Stadt (Naturinventar),Frei Martin,"4150294",LC,K,L,,,,,,,LC,,,,,Asteraceae,,INN,,
infoflora:42200,Gefässpflanzen,Grosse Klette,Arctium lappa L.,www.infoflora.ch/flora/1004610,Basel,BS,,249-251,"2612169","1267374","13",A,,,"2020","7","7",,"Info Flora, Edwin Leisibach",Leisibach Edwin,"9166883",LC,K,L,,,,,,,LC,,,,,Asteraceae,,INN,,
infoflora:42300,Gefässpflanzen,Kleine Klette,Arctium minus Bernh.,www.infoflora.ch/flora/1004620,Basel,BS,"Kleinbasler Rheinufer unterhalb Schwarzwaldbrücke. Ruderalstandorte, Trittfluren, Pflaesterungen. Hauptnutzung: Fliessgewaesser.","250","2613037","1267548","100",A,Bestandesklasse: klein,,"2008","7","9",,Kanton Basel Stadt (Naturinventar),Lüthi Roland,"4146202",LC,K,,,,,,,,LC,,,,,Asteraceae,,INN,,
infoflora:42300,Gefässpflanzen,Kleine Klette,Arctium minus Bernh.,www.infoflora.ch/flora/1004620,Basel,BS,"Mühlegraben bei St. Alban-Tal. Wiesen, Weiden, Scherrasen. Hauptnutzung: Hist. Altstadt / Dorfkern / City / Mischnutzungen.",251-258,"2612463","1267085","82",A,Bestandesklasse: klein,,"2008","6","13",,Kanton Basel Stadt (Naturinventar),Lüthi Roland,"4151562",LC,K,,,,,,,,LC,,,,,Asteraceae,,INN,,
infoflora:42300,Gefässpflanzen,Kleine Klette,Arctium minus Bernh.,www.infoflora.ch/flora/1004620,Basel,BS,"Kleinbasler Rheinberme zw. St. Alban-Fähre u. Beginn Solitude-Park. Ruderalstandorte, Trittfluren, Pflaesterungen. Hauptnutzung: Fliessgewaesser.","250","2612429","1267379","119",A,Bestandesklasse: klein,,"2008","7","23",,Kanton Basel Stadt (Naturinventar),Lüthi Roland,"4146449",LC,K,,,,,,,,LC,,,,,Asteraceae,,INN,,
infoflora:42300,Gefässpflanzen,Kleine Klette,Arctium minus Bernh.,www.infoflora.ch/flora/1004620,Basel,BS,"Waldsteilufer auf der Höhe der Roche; Kleinbasler Rheinböschung. Hecken, Gebuesche, Feldgehoelze. Hauptnutzung: Fliessgewaesser.","250","2612694","1267449","169",A,Bestandesklasse: mittel,,"2008","7","23",,Kanton Basel Stadt (Naturinventar),Lüthi Roland,"4146408",LC,K,,,,,,,,LC,,,,,Asteraceae,,INN,,
infoflora:42300,Gefässpflanzen,Kleine Klette,Arctium minus Bernh.,www.infoflora.ch/flora/1004620,Basel,BS,"Kleinbasler Berme zw. Wettst.brücke u. St. Alban-Fähre, rud. Pflästerung, Uferst. Ruderalstandorte, Trittfluren, Pflaesterungen. Hauptnutzung: Fliessgewaesser.",249-250,"2612114","1267378","214",A,Bestandesklasse: mittel,,"2008","7","23",,Kanton Basel Stadt (Naturinventar),Lüthi Roland,"4146596",LC,K,,,,,,,,LC,,,,,Asteraceae,,INN,,
infoflora:42300,Gefässpflanzen,Kleine Klette,Arctium minus Bernh.,www.infoflora.ch/flora/1004620,Basel,BS,"Kleinbasler Rheinberme zw. Wettsteinbrücke u. St. Alban-Fähre, rasiger Oberstrei. Wiesen, Weiden, Scherrasen. Hauptnutzung: Fliessgewaesser.",249-252,"2612187","1267370","121",A,Bestandesklasse: mittel,,"2008","7","23",,Kanton Basel Stadt (Naturinventar),Lüthi Roland,"4146498",LC,K,,,,,,,,LC,,,,,Asteraceae,,INN,,
infoflora:42300,Gefässpflanzen,Kleine Klette,Arctium minus Bernh.,www.infoflora.ch/flora/1004620,Basel,BS,"Cécile-Ines-Loos-Anlage, Wiesenberieche. Wiesen, Weiden, Scherrasen. Hauptnutzung: oeffentliche Parks, Anlagen, Friedhoefe.",250-254,"2613172","1267318","48",A,Bestandesklasse: klein,,"2008","6","5",,Kanton Basel Stadt (Naturinventar),Frei Martin,"4150234",LC,K,,,,,,,,LC,,,,,Asteraceae,,INN,,
infoflora:42300,Gefässpflanzen,Kleine Klette,Arctium minus Bernh.,www.infoflora.ch/flora/1004620,Basel,BS,"Letziplatz im St. Alban-Tal. Ruderalstandorte, Trittfluren, Pflaesterungen. Hauptnutzung: Hist. Altstadt / Dorfkern / City / Mischnutzungen.",251-258,"2612441","1267087","85",A,Bestandesklasse: klein,,"2008","6","13",,Kanton Basel Stadt (Naturinventar),Lüthi Roland,"4152233",LC,K,,,,,,,,LC,,,,,Asteraceae,,INN,,
infoflora:42300,Gefässpflanzen,Kleine Klette,Arctium minus Bernh.,www.infoflora.ch/flora/1004620,Basel,BS,"Kleinbasler Rheinufer, grasiger Oberstreifen mit Bäumen, zw. St. Alban-Fähre u.. Wiesen, Weiden, Scherrasen. Hauptnutzung: Fliessgewaesser.","250","2612431","1267384","117",A,Bestandesklasse: mittel,,"2008","7","23",,Kanton Basel Stadt (Naturinventar),Lüthi Roland,"4146431",LC,K,,,,,,,,LC,,,,,Asteraceae,,INN,,
infoflora:42300,Gefässpflanzen,Kleine Klette,Arctium minus Bernh.,www.infoflora.ch/flora/1004620,Basel,BS,"Cécile-Ines-Loos-Anlage, Gebüschbereiche. Hecken, Gebuesche, Feldgehoelze. Hauptnutzung: oeffentliche Parks, Anlagen, Friedhoefe.",251-255,"2613156","1267310","45",A,Bestandesklasse: klein,,"2009",,,,Kanton Basel Stadt (Naturinventar),?,"4150196",LC,K,,,,,,,,LC,,,,,Asteraceae,,INN,,
infoflora:42400,Gefässpflanzen,Gewöhnliche Kleine Klette,Arctium minus Bernh. subsp. minus,www.infoflora.ch/flora/1004630,Basel,BS,"Schaffhauser Rheinweg, Büschung an Rhein (befestigtes Ufer)","250","2612291","1267364","5",A,,,"2015","7","12",,"Info Flora, Lucas Förderer",Förderer Lucas,"5213022",LC,K,L,,,,,,,NE,"TypoCH 9 : Bauten, Anlagen",,,,Asteraceae,,INN,,
infoflora:44305,Gefässpflanzen,Quendelblättriges Sandkraut,Arenaria serpyllifolia aggr.,www.infoflora.ch/flora/1004800,Basel,BS,"Cécile-Ines-Loos-Anlage, Wiesenberieche. Wiesen, Weiden, Scherrasen. Hauptnutzung: oeffentliche Parks, Anlagen, Friedhoefe.",250-254,"2613172","1267318","48",A,Bestandesklasse: gross,,"2008","6","5",,Kanton Basel Stadt (Naturinventar),Frei Martin,"4150208",LC,K,,,,,,,,LC,,,,,Caryophyllaceae,,INN,,
infoflora:44305,Gefässpflanzen,Quendelblättriges Sandkraut,Arenaria serpyllifolia aggr.,www.infoflora.ch/flora/1004800,Basel,BS,"Verkehrsgrün Zürcherstrasse/Breite. Wiesen, Weiden, Scherrasen. Hauptnutzung: Strassenraum.",253-256,"2613209","1267226","61",A,Bestandesklasse: klein,,"2008","5","6",,Kanton Basel Stadt (Naturinventar),Frei Martin,"4158769",LC,K,,,,,,,,LC,,,,,Caryophyllaceae,,INN,,
infoflora:44305,Gefässpflanzen,Quendelblättriges Sandkraut,Arenaria serpyllifolia aggr.,www.infoflora.ch/flora/1004800,Basel,BS,"Rheinberme zw. Rheinbad Breite und Bollwerk St. Alban. Ruderalstandorte, Trittfluren, Pflaesterungen. Hauptnutzung: Fliessgewaesser.",250-251,"2612703","1267237","251",A,Bestandesklasse: klein,,"2008","7","8",,Kanton Basel Stadt (Naturinventar),Lüthi Roland,"4151924",LC,K,,,,,,,,LC,,,,,Caryophyllaceae,,INN,,
infoflora:44300,Gefässpflanzen,Gewöhnliches Quendelblättriges Sandkraut,Arenaria serpyllifolia L.,www.infoflora.ch/flora/1004810,Basel,BS,zwischen Bodenplatten auf dem Flachdach,255-255,"2612247","1267501","2",A,,,"2022","5","17",,"Flora beider Basel, Dóra Steták",Steták Dóra,"12073405",LC,K,,,,,,,,LC,,,,,Caryophyllaceae,,INN,,
infoflora:47900,Gefässpflanzen,Verlotscher Beifuss,Artemisia verlotiorum Lamotte,www.infoflora.ch/flora/1005150,Basel,BS,"Schaffhauser Rheinweg, Büschung an Rhein (befestigtes Ufer)","255","2612296","1267384","5",A,,,"2015","7","12",,"Info Flora, Lucas Förderer",Förderer Lucas,"5213015",,,,,,,,,,,"TypoCH 9 : Bauten, Anlagen",,,,Asteraceae,,NLS,"1",
infoflora:48000,Gefässpflanzen,Gemeiner Beifuss,Artemisia vulgaris L.,www.infoflora.ch/flora/1005160,Basel,BS,"Kleinbasler Rheinufer unterhalb Schwarzwaldbrücke. Ruderalstandorte, Trittfluren, Pflaesterungen. Hauptnutzung: Fliessgewaesser.","250","2613037","1267548","100",A,Bestandesklasse: klein,,"2008","7","9",,Kanton Basel Stadt (Naturinventar),Lüthi Roland,"4146206",LC,K,,,,,,,,LC,,,,,Asteraceae,,INN,,
infoflora:48000,Gefässpflanzen,Gemeiner Beifuss,Artemisia vulgaris L.,www.infoflora.ch/flora/1005160,Basel,BS,"Cécile-Ines-Loos-Anlage, Wiesenberieche. Wiesen, Weiden, Scherrasen. Hauptnutzung: oeffentliche Parks, Anlagen, Friedhoefe.",250-254,"2613172","1267318","48",A,Bestandesklasse: klein,,"2008","6","5",,Kanton Basel Stadt (Naturinventar),Frei Martin,"4150230",LC,K,,,,,,,,LC,,,,,Asteraceae,,INN,,
infoflora:48000,Gefässpflanzen,Gemeiner Beifuss,Artemisia vulgaris L.,www.infoflora.ch/flora/1005160,Basel,BS,"Kleinbasler Rheinberme zw. St. Alban-Fähre u. Beginn Solitude-Park. Ruderalstandorte, Trittfluren, Pflaesterungen. Hauptnutzung: Fliessgewaesser.","250","2612429","1267379","119",A,Bestandesklasse: mittel,,"2008","7","23",,Kanton Basel Stadt (Naturinventar),Lüthi Roland,"4146446",LC,K,,,,,,,,LC,,,,,Asteraceae,,INN,,
infoflora:48000,Gefässpflanzen,Gemeiner Beifuss,Artemisia vulgaris L.,www.infoflora.ch/flora/1005160,Basel,BS,"Mühlegraben bei St. Alban-Tal. Wiesen, Weiden, Scherrasen. Hauptnutzung: Hist. Altstadt / Dorfkern / City / Mischnutzungen.",251-258,"2612463","1267085","82",A,Bestandesklasse: klein,,"2008","6","13",,Kanton Basel Stadt (Naturinventar),Lüthi Roland,"4151554",LC,K,,,,,,,,LC,,,,,Asteraceae,,INN,,
infoflora:48000,Gefässpflanzen,Gemeiner Beifuss,Artemisia vulgaris L.,www.infoflora.ch/flora/1005160,Basel,BS,"Rheinböschung zw. Schwarzwaldbrücke und Rheinbord Breite. Ruderalstandorte, Trittfluren, Pflaesterungen. Hauptnutzung: Fliessgewaesser.",250-251,"2613078","1267334","151",A,Bestandesklasse: mittel,,"2008","7","8",,Kanton Basel Stadt (Naturinventar),Lüthi Roland,"4151872",LC,K,,,,,,,,LC,,,,,Asteraceae,,INN,,
infoflora:48000,Gefässpflanzen,Gemeiner Beifuss,Artemisia vulgaris L.,www.infoflora.ch/flora/1005160,Basel,BS,"Rheinberme zw. Rheinbad Breite und Bollwerk St. Alban. Ruderalstandorte, Trittfluren, Pflaesterungen. Hauptnutzung: Fliessgewaesser.",250-251,"2612703","1267237","251",A,Bestandesklasse: mittel,,"2008","7","8",,Kanton Basel Stadt (Naturinventar),Lüthi Roland,"4151912",LC,K,,,,,,,,LC,,,,,Asteraceae,,INN,,
infoflora:48000,Gefässpflanzen,Gemeiner Beifuss,Artemisia vulgaris L.,www.infoflora.ch/flora/1005160,Basel,BS,"Rheinberme zw. Wettsteinbrücke und Bollwerk St. Alban. Ruderalstandorte, Trittfluren, Pflaesterungen. Hauptnutzung: Fliessgewaesser.",249-262,"2612106","1267197","288",A,Bestandesklasse: mittel,,"2008","7","8",,Kanton Basel Stadt (Naturinventar),Lüthi Roland,"4151944",LC,K,,,,,,,,LC,,,,,Asteraceae,,INN,,
infoflora:48000,Gefässpflanzen,Gemeiner Beifuss,Artemisia vulgaris L.,www.infoflora.ch/flora/1005160,Basel,BS,"Kleinbasler Rheinufer, grasiger Oberstreifen mit Bäumen, zw. St. Alban-Fähre u.. Wiesen, Weiden, Scherrasen. Hauptnutzung: Fliessgewaesser.","250","2612431","1267384","117",A,Bestandesklasse: mittel,,"2008","7","23",,Kanton Basel Stadt (Naturinventar),Lüthi Roland,"4146429",LC,K,,,,,,,,LC,,,,,Asteraceae,,INN,,
infoflora:48000,Gefässpflanzen,Gemeiner Beifuss,Artemisia vulgaris L.,www.infoflora.ch/flora/1005160,Basel,BS,"Verkehrsgrün Zürcherstrasse/Breite. Wiesen, Weiden, Scherrasen. Hauptnutzung: Strassenraum.",253-256,"2613209","1267226","61",A,Bestandesklasse: klein,,"2008","5","6",,Kanton Basel Stadt (Naturinventar),Frei Martin,"4158757",LC,K,,,,,,,,LC,,,,,Asteraceae,,INN,,
infoflora:48000,Gefässpflanzen,Gemeiner Beifuss,Artemisia vulgaris L.,www.infoflora.ch/flora/1005160,Basel,BS,"Kleinbasler Berme zw. Wettst.brücke u. St. Alban-Fähre, rud. Pflästerung, Uferst. Ruderalstandorte, Trittfluren, Pflaesterungen. Hauptnutzung: Fliessgewaesser.",249-250,"2612114","1267378","214",A,Bestandesklasse: mittel,,"2008","7","23",,Kanton Basel Stadt (Naturinventar),Lüthi Roland,"4146601",LC,K,,,,,,,,LC,,,,,Asteraceae,,INN,,
infoflora:48000,Gefässpflanzen,Gemeiner Beifuss,Artemisia vulgaris L.,www.infoflora.ch/flora/1005160,Basel,BS,"Kleinbasler Rheinberme zw. Wettsteinbrücke u. St. Alban-Fähre, rasiger Oberstrei. Wiesen, Weiden, Scherrasen. Hauptnutzung: Fliessgewaesser.",249-252,"2612187","1267370","121",A,Bestandesklasse: mittel,,"2008","7","23",,Kanton Basel Stadt (Naturinventar),Lüthi Roland,"4146500",LC,K,,,,,,,,LC,,,,,Asteraceae,,INN,,
infoflora:48000,Gefässpflanzen,Gemeiner Beifuss,Artemisia vulgaris L.,www.infoflora.ch/flora/1005160,Basel,BS,,249-250,"2612023","1267375","5",A,,,"2021","6","11",,"Flora beider Basel, Ursina Studer",Studer Ursina,"10354161",LC,K,,,,,,,,LC,,,,,Asteraceae,,INN,,
infoflora:48000,Gefässpflanzen,Gemeiner Beifuss,Artemisia vulgaris L.,www.infoflora.ch/flora/1005160,Basel,BS,,248-255,"2612026","1267386","90",A,,,"2022","8","16",,"Flora beider Basel, René Sollberger",Sollberger René,"12539751",LC,K,,,,,,,,LC,,,,,Asteraceae,,INN,,
infoflora:48200,Gefässpflanzen,Gemeiner Aronstab,Arum maculatum L.,www.infoflora.ch/flora/1005180,Basel,BS,"Terrassenrand St. Alban - Teich. Waelder, Waldschlaege. Hauptnutzung: Laubwaelder.",258-260,"2612476","1267002","57",A,Bestandesklasse: klein,,"2009","5","12",,Kanton Basel Stadt (Naturinventar),Frei Martin,"4161113",LC,K,,,,,,,,LC,,,,,Araceae,,INN,,
infoflora:48300,Gefässpflanzen,Wald-Geissbart,Aruncus dioicus (Walter) Fernald,www.infoflora.ch/flora/1005190,Basel,BS,"Castellio-Weglein. Einzelbaeume, Alleen, Baumhaine. Hauptnutzung: oeffentliche Parks, Anlagen, Friedhoefe.",256-270,"2612160","1267093","61",A,Bestandesklasse: klein,,"2008","5","10",,Kanton Basel Stadt (Naturinventar),Frei Martin,"4159749",LC,K,,,,,,,,LC,,,,,Rosaceae,,INN,,
infoflora:50900,Gefässpflanzen,Mauerraute,Asplenium ruta-muraria L.,www.infoflora.ch/flora/1005500,Basel,BS,"Grossbasler Rheinufer zw. Wettsteinbrücke und Pfalz. Ruderalstandorte, Trittfluren, Pflaesterungen. Hauptnutzung: Fliessgewaesser.",250-264,"2611761","1267254","45",A,Bestandesklasse: klein,,"2008","7","8",,Kanton Basel Stadt (Naturinventar),Lüthi Roland,"4151980",LC,K,,,,,,,,LC,,,,,Aspleniaceae,,INN,,
infoflora:50900,Gefässpflanzen,Mauerraute,Asplenium ruta-muraria L.,www.infoflora.ch/flora/1005500,Basel,BS,"Rheinberme zw. Wettsteinbrücke und Bollwerk St. Alban. Ruderalstandorte, Trittfluren, Pflaesterungen. Hauptnutzung: Fliessgewaesser.",249-262,"2612106","1267197","288",A,Bestandesklasse: mittel,,"2008","7","8",,Kanton Basel Stadt (Naturinventar),Lüthi Roland,"4151938",LC,K,,,,,,,,LC,,,,,Aspleniaceae,,INN,,
infoflora:50900,Gefässpflanzen,Mauerraute,Asplenium ruta-muraria L.,www.infoflora.ch/flora/1005500,Basel,BS,"Rheinberme zw. Rheinbad Breite und Bollwerk St. Alban. Ruderalstandorte, Trittfluren, Pflaesterungen. Hauptnutzung: Fliessgewaesser.",250-251,"2612703","1267237","251",A,Bestandesklasse: mittel,,"2008","7","8",,Kanton Basel Stadt (Naturinventar),Lüthi Roland,"4151896",LC,K,,,,,,,,LC,,,,,Aspleniaceae,,INN,,
infoflora:50900,Gefässpflanzen,Mauerraute,Asplenium ruta-muraria L.,www.infoflora.ch/flora/1005500,Basel,BS,"Kleinbasler Rheinufer unterhalb Schwarzwaldbrücke. Ruderalstandorte, Trittfluren, Pflaesterungen. Hauptnutzung: Fliessgewaesser.","250","2613037","1267548","100",A,Bestandesklasse: mittel,,"2008","7","9",,Kanton Basel Stadt (Naturinventar),Lüthi Roland,"4146176",LC,K,,,,,,,,LC,,,,,Aspleniaceae,,INN,,
infoflora:50900,Gefässpflanzen,Mauerraute,Asplenium ruta-muraria L.,www.infoflora.ch/flora/1005500,Basel,BS,"St. Alban-Teich Weidengasse-Zürcherstrasse. Mauern, Felsen. Hauptnutzung: Fliessgewaesser.",258-261,"2612670","1267015","153",A,Bestandesklasse: mittel,,"2008","8","28",,Kanton Basel Stadt (Naturinventar),Frei Martin,"4158934",LC,K,,,,,,,,LC,,,,,Aspleniaceae,,INN,,
infoflora:50900,Gefässpflanzen,Mauerraute,Asplenium ruta-muraria L.,www.infoflora.ch/flora/1005500,Basel,BS,"Kleinbasler Rheinberme zw. St. Alban-Fähre u. Beginn Solitude-Park. Ruderalstandorte, Trittfluren, Pflaesterungen. Hauptnutzung: Fliessgewaesser.","250","2612429","1267379","119",A,Bestandesklasse: klein,,"2008","7","23",,Kanton Basel Stadt (Naturinventar),Lüthi Roland,"4146484",LC,K,,,,,,,,LC,,,,,Aspleniaceae,,INN,,
infoflora:50900,Gefässpflanzen,Mauerraute,Asplenium ruta-muraria L.,www.infoflora.ch/flora/1005500,Basel,BS,"Waldsteilufer auf der Höhe der Roche; Kleinbasler Rheinböschung. Hecken, Gebuesche, Feldgehoelze. Hauptnutzung: Fliessgewaesser.","250","2612694","1267449","169",A,Bestandesklasse: mittel,,"2008","7","23",,Kanton Basel Stadt (Naturinventar),Lüthi Roland,"4146419",LC,K,,,,,,,,LC,,,,,Aspleniaceae,,INN,,
infoflora:51400,Gefässpflanzen,Braunstieliger Streifenfarn,Asplenium trichomanes L.,www.infoflora.ch/flora/1005550,Basel,BS,"Rheinberme zw. Wettsteinbrücke und Bollwerk St. Alban. Ruderalstandorte, Trittfluren, Pflaesterungen. Hauptnutzung: Fliessgewaesser.",249-262,"2612106","1267197","288",A,Bestandesklasse: klein,,"2008","7","8",,Kanton Basel Stadt (Naturinventar),Lüthi Roland,"4151941",LC,K,,,,,,,,LC,,,,,Aspleniaceae,,INN,,
infoflora:51400,Gefässpflanzen,Braunstieliger Streifenfarn,Asplenium trichomanes L.,www.infoflora.ch/flora/1005550,Basel,BS,"St. Alban-Teich Weidengasse-Zürcherstrasse. Mauern, Felsen. Hauptnutzung: Fliessgewaesser.",258-261,"2612670","1267015","153",A,Bestandesklasse: mittel,,"2008","8","28",,Kanton Basel Stadt (Naturinventar),Frei Martin,"4158929",LC,K,,,,,,,,LC,,,,,Aspleniaceae,,INN,,
infoflora:51400,Gefässpflanzen,Braunstieliger Streifenfarn,Asplenium trichomanes L.,www.infoflora.ch/flora/1005550,Basel,BS,"Waldsteilufer auf der Höhe der Roche; Kleinbasler Rheinböschung. Hecken, Gebuesche, Feldgehoelze. Hauptnutzung: Fliessgewaesser.","250","2612694","1267449","169",A,Bestandesklasse: klein,,"2008","7","23",,Kanton Basel Stadt (Naturinventar),Lüthi Roland,"4146424",LC,K,,,,,,,,LC,,,,,Aspleniaceae,,INN,,
infoflora:56900,Gefässpflanzen,Flug-Hafer,Avena fatua L.,www.infoflora.ch/flora/1006240,Basel,BS,Nun von Weg oberhalb Böschung in Böschung reinblickend,"252","2612245","1267379","4",A,,,"2021","6","11",,"Flora beider Basel, Ursina Studer",Studer Ursina,"10354122",LC,K,,,,,,,,LC,,,,,Poaceae,,INN,,
infoflora:56900,Gefässpflanzen,Flug-Hafer,Avena fatua L.,www.infoflora.ch/flora/1006240,Basel,BS,,249-251,"2612169","1267375","6",A,,,"2022","5","20",,"COMECO project, WSL & Info Flora",de Witte Lucienne,"12076449",LC,K,,,,,,,,LC,,,,,Poaceae,,INN,,
infoflora:56900,Gefässpflanzen,Flug-Hafer,Avena fatua L.,www.infoflora.ch/flora/1006240,Basel,BS,,250-252,"2612239","1267377","6",A,,,"2022","5","15",,"Flora beider Basel, Lucienne de Witte",de Witte Lucienne,"11831659",LC,K,,,,,,,,LC,,,,,Poaceae,,INN,,
infoflora:58600,Gefässpflanzen,Gemeine Winterkresse,Barbarea vulgaris R. Br.,www.infoflora.ch/flora/1006450,Basel,BS,"Rheinberme zw. Rheinbad Breite und Bollwerk St. Alban. Ruderalstandorte, Trittfluren, Pflaesterungen. Hauptnutzung: Fliessgewaesser.",250-251,"2612703","1267237","251",A,Bestandesklasse: klein,,"2008","7","8",,Kanton Basel Stadt (Naturinventar),Lüthi Roland,"4151906",LC,K,,,,,,,,LC,,,,,Brassicaceae,,INN,,
infoflora:58600,Gefässpflanzen,Gemeine Winterkresse,Barbarea vulgaris R. Br.,www.infoflora.ch/flora/1006450,Basel,BS,,250-250,"2612801","1267251","6",A,,,"2022","5","15",,"Flora beider Basel, Lucienne de Witte",de Witte Lucienne,"11831648",LC,K,,,,,,,,LC,,,,,Brassicaceae,,INN,,
infoflora:59400,Gefässpflanzen,Graukresse,Berteroa incana (L.) DC.,www.infoflora.ch/flora/1006550,Basel,BS,"Letziplatz im St. Alban-Tal. Ruderalstandorte, Trittfluren, Pflaesterungen. Hauptnutzung: Hist. Altstadt / Dorfkern / City / Mischnutzungen.",251-258,"2612441","1267087","85",A,Bestandesklasse: mittel,,"2008","6","13",,Kanton Basel Stadt (Naturinventar),Lüthi Roland,"4152227",,,,,,,,,,,,,,,Brassicaceae,,NEO,"1",
infoflora:59400,Gefässpflanzen,Graukresse,Berteroa incana (L.) DC.,www.infoflora.ch/flora/1006550,Basel,BS,"Kleinbasler Berme zw. Wettst.brücke u. St. Alban-Fähre, rud. Pflästerung, Uferst. Ruderalstandorte, Trittfluren, Pflaesterungen. Hauptnutzung: Fliessgewaesser.",249-250,"2612114","1267378","214",A,Bestandesklasse: mittel,,"2008","7","23",,Kanton Basel Stadt (Naturinventar),Lüthi Roland,"4146605",,,,,,,,,,,,,,,Brassicaceae,,NEO,"1",
infoflora:59400,Gefässpflanzen,Graukresse,Berteroa incana (L.) DC.,www.infoflora.ch/flora/1006550,Basel,BS,Zürcherstrasse. Rabatte.,"255","2613221","1267246","7",A,,,"2011","6","26",,"Info Flora, Lucas Förderer",Förderer Lucas,"3190048",,,,,,,,,,,"TypoCH 9 : Bauten, Anlagen",,,,Brassicaceae,,NEO,"1",
infoflora:59400,Gefässpflanzen,Graukresse,Berteroa incana (L.) DC.,www.infoflora.ch/flora/1006550,Basel,BS,Schaffhauser Rheinweg. Uferböschung an Rhein.,"250","2612057","1267368","5",A,,,"2013","10","27",,"Info Flora, Lucas Förderer",Förderer Lucas,"4196917",,,,,,,,,,,"TypoCH 5 : Krautsäume, Hochstaudenfluren und Gebüsche",,,,Brassicaceae,,NEO,"1",
infoflora:59400,Gefässpflanzen,Graukresse,Berteroa incana (L.) DC.,www.infoflora.ch/flora/1006550,Basel,BS,"Schaffhauser Rheinweg, Büschung an Rhein (befestigtes Ufer)","255","2612192","1267372","5",A,,,"2015","7","3",,"Info Flora, Lucas Förderer",Förderer Lucas,"5212997",,,,,,,,,,,"TypoCH 9 : Bauten, Anlagen",,,,Brassicaceae,,NEO,"1",
infoflora:59400,Gefässpflanzen,Graukresse,Berteroa incana (L.) DC.,www.infoflora.ch/flora/1006550,Basel,BS,,"272","2612404","1267099","5",A,,,"2016","8","24",,"Info Flora, Wolfgang Bischoff",Bischoff Wolfgang,"5427759",,,,,,,,,,,,,,,Brassicaceae,,NEO,"1",
infoflora:59400,Gefässpflanzen,Graukresse,Berteroa incana (L.) DC.,www.infoflora.ch/flora/1006550,Basel,BS,,249-251,"2612172","1267377","12",A,,,"2019","5","25",,"Info Flora, Alexander Indermaur",Indermaur Alexander,"7752758",,,,,,,,,,,,,,,Brassicaceae,,NEO,"1",
infoflora:59400,Gefässpflanzen,Graukresse,Berteroa incana (L.) DC.,www.infoflora.ch/flora/1006550,Basel,BS,,250-250,"2611973","1267381","6",A,,,"2020","7","7",,"Info Flora, Edwin Leisibach",Leisibach Edwin,"9166888",,,,,,,,,,,,,,,Brassicaceae,,NEO,"1",
infoflora:59400,Gefässpflanzen,Graukresse,Berteroa incana (L.) DC.,www.infoflora.ch/flora/1006550,Basel,BS,,"250","2612131","1267362","10",A,,,"2020","5","24",,"Info Flora, Dominik Keller",Keller Dominik,"8966754",,,,,,,,,,,,,,,Brassicaceae,,NEO,"1",
infoflora:59400,Gefässpflanzen,Graukresse,Berteroa incana (L.) DC.,www.infoflora.ch/flora/1006550,Basel,BS,"St. Alban-Anlage; Meuerfuss",255-260,"2612426","1267155","5",A,1–10 (Individuen),,"2020","12","23",,"Info Flora, Lucas Förderer",Förderer Lucas,"10027276",,,,,,,,,,,"TypoCH 9 : Bauten, Anlagen",,,,Brassicaceae,,NEO,"1",
infoflora:59400,Gefässpflanzen,Graukresse,Berteroa incana (L.) DC.,www.infoflora.ch/flora/1006550,Basel,BS,,"250","2612033","1267371","2",A,,,"2020","5","21",,"Info Flora, Nico Heer",Heer Nico,"8964333",,,,,,,,,,,,,,,Brassicaceae,,NEO,"1",
infoflora:59400,Gefässpflanzen,Graukresse,Berteroa incana (L.) DC.,www.infoflora.ch/flora/1006550,Basel,BS,,"250","2612054","1267365","2",A,11–25 (Individuen),,"2020","4","24",,"Info Flora, Frederik Baumgarten",Baumgarten Frederik,"8847606",,,,,,,,,,,,,,,Brassicaceae,,NEO,"1",
infoflora:59400,Gefässpflanzen,Graukresse,Berteroa incana (L.) DC.,www.infoflora.ch/flora/1006550,Basel,BS,,250-250,"2612061","1267368","9",A,,,"2021","6","11",,"Flora beider Basel, Ursina Studer",Studer Ursina,"10354146",,,,,,,,,,,,,,,Brassicaceae,,NEO,"1",
infoflora:59400,Gefässpflanzen,Graukresse,Berteroa incana (L.) DC.,www.infoflora.ch/flora/1006550,Basel,BS,,249-250,"2612023","1267375","5",A,,,"2021","6","11",,"Flora beider Basel, Ursina Studer",Studer Ursina,"10354160",,,,,,,,,,,,,,,Brassicaceae,,NEO,"1",
infoflora:59400,Gefässpflanzen,Graukresse,Berteroa incana (L.) DC.,www.infoflora.ch/flora/1006550,Basel,BS,,248-250,"2612172","1267351","14",A,,,"2021","7","30",,"Info Flora, Daniel Hepenstrick",Hepenstrick Daniel,"10821852",,,,,,,,,,,,,,,Brassicaceae,,NEO,"1",
infoflora:59400,Gefässpflanzen,Graukresse,Berteroa incana (L.) DC.,www.infoflora.ch/flora/1006550,Basel,BS,,"250","2612085","1267364","6",A,,,"2021","8","6",,Flora beider Basel,Anonym.,"10699947",,,,,,,,,,,,,,,Brassicaceae,,NEO,"1",
infoflora:59400,Gefässpflanzen,Graukresse,Berteroa incana (L.) DC.,www.infoflora.ch/flora/1006550,Basel,BS,,249-250,"2612023","1267378","4",A,,,"2022","5","26",,"Info Flora, Marco Pacchiarini",Pacchiarini Marco,"12695731",,,,,,,,,,,,,,,Brassicaceae,,NEO,"1",
infoflora:59400,Gefässpflanzen,Graukresse,Berteroa incana (L.) DC.,www.infoflora.ch/flora/1006550,Basel,BS,,250-250,"2612104","1267374","6",A,,,"2022","5","15",,"Flora beider Basel, Lucienne de Witte",de Witte Lucienne,"11831663",,,,,,,,,,,,,,,Brassicaceae,,NEO,"1",
infoflora:59400,Gefässpflanzen,Graukresse,Berteroa incana (L.) DC.,www.infoflora.ch/flora/1006550,Basel,BS,,250-254,"2612162","1267389","19",A,,,"2022","8","16",,"Flora beider Basel, René Sollberger",Sollberger René,"12539752",,,,,,,,,,,,,,,Brassicaceae,,NEO,"1",
